{
  "id": "example-professional-agent",
  "name": "Example Professional Agent",
  "kind": "custom",
  "sourceTemplate": "professional-baseline",
  "version": "1.0.0",
  "status": "draft",
  "owner": "Ralleh",
  "purpose": "Demonstrates the generation flow from the baseline template",
  "tags": [
    "example",
    "baseline"
  ],
  "path": "agents/custom/example-professional-agent"
}
